{
  "schemaVersion": 1,
  "status": "approved",
  "placementSha256": "691f85d010b147d2c77f867c7b606e0bcccaccfc782dc338ee9ef8c7cda7268c",
  "characterSha256": "2d62ecce77355c2c52b27a7704afc54c53250b0064ea38a77e36c4133938a065",
  "itemSha256": "b65774b8772c73019523ff9f90e3754d355f5bf34b9f4e34c4f91fc014fb3ddd",
  "protectedIntersectionRatio": 0,
  "visible": true,
  "fullCard": {
    "path": "docs/design/game-reviews/placements/ga-1470H-front-spark.png",
    "sha256": "3d3336013296b7e514218f2b9e2ef4de8ebaec65fc6899e3faeda3b7d47d758d"
  },
  "at72": {
    "path": "docs/design/game-reviews/placements/ga-1470H-front-spark-72.png",
    "sha256": "a9bda7cfc8d99fcb890c5990174f9ff7ac693bfc7341d29fe24bb37f06ce08cc"
  }
}
