{
  "schemaVersion": 1,
  "status": "approved",
  "placementSha256": "1334609bb72526d8e1e09222f34a7293f045e2112da11f126f4f0aaf3091142b",
  "characterSha256": "0c418430290b14a7834eb9bf8e37a6f7912cf521f92dc1c1d61965663df42011",
  "itemSha256": "3d1f8fe32e87e201ab8cc97249da929f6415b86e4038ae5be5d4c39f4e1582df",
  "protectedIntersectionRatio": 0,
  "visible": true,
  "fullCard": {
    "path": "docs/design/game-reviews/placements/ssial-270F-front-shield.png",
    "sha256": "f45bda02281058ea45f5b6b0b4fc6fcecee596d1fefc429f6e62521e19cea7fc"
  },
  "at72": {
    "path": "docs/design/game-reviews/placements/ssial-270F-front-shield-72.png",
    "sha256": "396d96bdcdc22a814b15d8595f895df13a5a992ae942dd01c1e6bac4e056e225"
  }
}
