{
  "schemaVersion": 1,
  "status": "approved",
  "placementSha256": "88591cbc7727ff186866feee77cd930728e494f6b1225b26e2e691f710efc95b",
  "characterSha256": "56c20f0f8dd1e4224ecf314721a913e92a82fb9fb915d97676e9877f2f89f365",
  "itemSha256": "41eff615155511936e8433e55771fb794092722e787410430cb17c5da1292afb",
  "protectedIntersectionRatio": 0,
  "visible": true,
  "fullCard": {
    "path": "docs/design/game-reviews/placements/ga-270D-front-arrow.png",
    "sha256": "da9694a5702105a2dd18bccb18e21ec794a29307665bee549b71369d5d541c0e"
  },
  "at72": {
    "path": "docs/design/game-reviews/placements/ga-270D-front-arrow-72.png",
    "sha256": "423a358b7b68995f0fa63472a019ff34e19f7b94f5024aee727e1607b45c0ac2"
  }
}
