{
  "schemaVersion": 1,
  "status": "approved",
  "placementSha256": "e728469383ad47ff7155ff388c6febee86148bdaadd6a6f5e228332c1479a23a",
  "characterSha256": "0d0e95092ff79a80d2c74b641cd0705d68c738115f13983dd21fd160b7be2803",
  "itemSha256": "41eff615155511936e8433e55771fb794092722e787410430cb17c5da1292afb",
  "protectedIntersectionRatio": 0,
  "visible": true,
  "fullCard": {
    "path": "docs/design/game-reviews/placements/ga-1470H-alt-arrow.png",
    "sha256": "0abb00d79e4aa17f39cc1155c54f2e7e483d9220780ea51a3c4a7689d96e7a20"
  },
  "at72": {
    "path": "docs/design/game-reviews/placements/ga-1470H-alt-arrow-72.png",
    "sha256": "c5dc8971020b713a7342f496d378cefa09fe7de32a1baa7bcea0e0e0a4a03b49"
  }
}
