{
  "schemaVersion": 1,
  "status": "approved",
  "placementSha256": "ae8a055e8a37ded2a8a5d616dfd3c0ea0d104355362e1c5ab11c47b65d97a54d",
  "characterSha256": "fe6e1cecfcf90f8840d346307b1785e7826159b9cb9d288bb553177dc06bc2a9",
  "itemSha256": "461d835cf0f68e643c20d2030b24f5a6bda2c0ae1926b23947b1e2669f7f7c0c",
  "protectedIntersectionRatio": 0,
  "visible": true,
  "fullCard": {
    "path": "docs/design/game-reviews/placements/ga-1180Y-front-iron.png",
    "sha256": "cf010c12fc9a6bb2deb4bceb25138eabfcfb04e040ad7d84b25cb3f3b5526fd6"
  },
  "at72": {
    "path": "docs/design/game-reviews/placements/ga-1180Y-front-iron-72.png",
    "sha256": "fa684a21e16bba4686d6188d20f95207623e175c3dd8fa0f99d483375c027f7f"
  }
}
