{
  "schemaVersion": 1,
  "status": "approved",
  "placementSha256": "b8b8ac4f47e6e267f893a401cc9632ef29273ec375714daf9661ad01745ee2b7",
  "characterSha256": "de7d1244d0d6e56a847cbd3d3f30f61f33662a24362b4c10beae0d317cdbb826",
  "itemSha256": "41eff615155511936e8433e55771fb794092722e787410430cb17c5da1292afb",
  "protectedIntersectionRatio": 0,
  "visible": true,
  "fullCard": {
    "path": "docs/design/game-reviews/placements/poo-270C-front-arrow.png",
    "sha256": "d12ff087539c47089d75e2b64bb193f58a2deb0120836145802d5a2a50fa1828"
  },
  "at72": {
    "path": "docs/design/game-reviews/placements/poo-270C-front-arrow-72.png",
    "sha256": "f16c3e79a043c26f7096f0f743a474f3484f7b27cf63bd8d6bcd23050df8e407"
  }
}
