{
  "schemaVersion": 1,
  "status": "approved",
  "placementSha256": "8ee45866475145f986e4b947cc3705860f2da1e52c566f892635dda02881f02e",
  "characterSha256": "70e5092018fe78b2d890ef4ebb764caa2d58eba8962146794aec3ff3dd8de3ca",
  "itemSha256": "41eff615155511936e8433e55771fb794092722e787410430cb17c5da1292afb",
  "protectedIntersectionRatio": 0,
  "visible": true,
  "fullCard": {
    "path": "docs/design/game-reviews/placements/ssial-1470M-front-arrow.png",
    "sha256": "0dda6bca3d868f376bf634e85e21a4a51f3689570f41a7c26b4ef1af5da748fd"
  },
  "at72": {
    "path": "docs/design/game-reviews/placements/ssial-1470M-front-arrow-72.png",
    "sha256": "661a46edc8d4cc026ef44cded8032d405a3eed057e830df772e14aa835e0c377"
  }
}
