{
  "schemaVersion": 1,
  "status": "approved",
  "placementSha256": "46c0320590021eca14bdc25ed8dc6c972201227d9cf46255ea2f0ce389aa38f7",
  "characterSha256": "c5f67c589ef32de93d6e9f1fe32ca6b631ac877f3eb4b96e68631150e8f9a2ef",
  "itemSha256": "3d1f8fe32e87e201ab8cc97249da929f6415b86e4038ae5be5d4c39f4e1582df",
  "protectedIntersectionRatio": 0,
  "visible": true,
  "fullCard": {
    "path": "docs/design/game-reviews/placements/ga-270E-front-shield.png",
    "sha256": "e9f33f57721b047f022334999255587c7e1ae47f3d0e10c89eaee8fc954d371c"
  },
  "at72": {
    "path": "docs/design/game-reviews/placements/ga-270E-front-shield-72.png",
    "sha256": "b3ec7acd0cc0a33c59fcee05f35f7d65bf53f4fc8934336bdd6f22316c1b8069"
  }
}
